{
  "template_version": 1,
  "generated_at": "2026-10-18",
  "opening": "Alright, here we go — a fresh little news dump, no fluff, just the bits that actually moved. It is what it is.",
  "closing": "That’s the lot for now — clean, simple, and no extra goblin energy.",
  "topics": [
    {
      "id": "fusion-energy-shortcut",
      "continues": null,
      "new_development": null,
      "title": "Scientists point to a shortcut for fusion ignition",
      "summary": "Researchers reported a potentially more efficient route to fusion ignition by reversing the usual sequence and heating plasma before increasing its density. The work was described as a possible shortcut toward practical fusion energy, with the result framed as a new approach rather than a finished reactor design.",
      "detail": "The report says the Princeton Plasma Physics Laboratory work suggests a different path to fusion ignition than the standard approach. The key idea is to heat the plasma first and only then raise its density. The sources do not say this has been turned into a commercial system yet, so keep the hype meter at a sane level, lads.",
      "keywords": [
        "fusion energy"
      ],
      "score": 85,
      "score_parts": {
        "relevance": 55,
        "attention": 30,
        "repeat_penalty": 0
      },
      "sources": [
        {
          "title": "Scientists may have found a shortcut to fusion energy",
          "publisher": "ScienceDaily",
          "url": "https://www.sciencedaily.com/releases/2026/10/261008005242.htm",
          "language": "en",
          "published": "2026-10-17"
        },
        {
          "title": "Fusion Energy",
          "publisher": "U.S. Department of Energy",
          "url": "https://www.energy.gov/fusion/fusion-energy",
          "language": "en",
          "published": "2024-06-04"
        }
      ]
    },
    {
      "id": "deep-sea-mining-trial-ecosystem-impact",
      "continues": null,
      "new_development": null,
      "title": "Deep-sea mining trial shows rapid seabed disruption",
      "summary": "A new paper described a deep-sea mining trial in the South China Sea that rapidly disrupted microbes tied to nutrient cycling on the seafloor. The story also notes that commercial deep-sea mining has not started, while regulators and companies are still moving through exploration and review steps.",
      "detail": "The article says samples came from a 2020 mining trial around 1,300 meters below sea level. It also says the International Seabed Authority has granted 31 exploration contracts, and that NOAA is reviewing an application related to The Metals Company in the Clarion-Clipperton Zone. Another report says American Metal’s exploration-license application advanced with NOAA certification for two subsidiaries, which is another reminder that the industry is still in the paperwork swamp, honestly.",
      "keywords": [
        "deep-sea mining"
      ],
      "score": 88,
      "score_parts": {
        "relevance": 57,
        "attention": 31,
        "repeat_penalty": 0
      },
      "sources": [
        {
          "title": "A Deep-Sea Mining Trial Rapidly Threw The Seafloor Ecosystem Off ...",
          "publisher": "Yahoo News",
          "url": "https://www.yahoo.com/news/science/articles/deep-sea-mining-trial-rapidly-080000631.html",
          "language": "en",
          "published": "2026-10-18"
        },
        {
          "title": "American Metal says US seabed mining exploration licence application advances",
          "publisher": "Mining.com.au",
          "url": "https://mining.com.au/american-metal-says-us-seabed-mining-exploration-licence-application-advances/",
          "language": "en",
          "published": "2026-10-16"
        }
      ]
    },
    {
      "id": "quantum-computing-darpa-funding",
      "continues": null,
      "new_development": null,
      "title": "US quantum push gets fresh funding and program advances",
      "summary": "Reports this week described new U.S. quantum computing funding and program activity, including a roughly $350 million package tied to DARPA and a loan commitment for PsiQuantum. Another item said the department announced new phase II Genesis Mission project awards and support for fault-tolerant quantum computers.",
      "detail": "The quantum coverage in the window focused on public-sector support and program progression rather than a single breakthrough device. One report tied the funding package to the Quantum Benchmarking Initiative and named Atom Computing, Diraq, IBM and IonQ among the selected companies. Another report highlighted new awards, early-career support, and a graduate fellowship program. This stuff is very much the ‘big institutions are still throwing money at the problem’ phase, which, to be fair, is how a lot of frontier tech grinds forward.",
      "keywords": [
        "quantum computing"
      ],
      "score": 79,
      "score_parts": {
        "relevance": 50,
        "attention": 29,
        "repeat_penalty": 0
      },
      "sources": [
        {
          "title": "Pentagon Announces $350M Quantum Computing Package",
          "publisher": "Post-Quantum",
          "url": "https://postquantum.com/industry-news/pentagons-350-million-quantum/",
          "language": "en",
          "published": "2026-10-09"
        },
        {
          "title": "Quantum Computing",
          "publisher": "Nextgov",
          "url": "https://www.nextgov.com/topic/quantum-computing/",
          "language": "en",
          "published": "2026-10-14"
        }
      ]
    }
  ]
}
