{
  "template_version": 1,
  "generated_at": "2026-10-18",
  "opening": "Here is a brief digest of the strongest matches from the week.",
  "closing": "That is the set for this window; the rest stayed quiet or off topic.",
  "topics": [
    {
      "id": "perseverance-distance-record",
      "continues": null,
      "new_development": null,
      "title": "Perseverance sets an off-world driving record",
      "summary": "NASA said Perseverance reached 28.10 miles driven on Mars on Oct. 11, passing the 28.06-mile record set by Opportunity. The rover now holds the record for total distance driven on another world.",
      "detail": "NASA said the rover’s odometer hit the mark on Oct. 11. The agency said the total eclipsed Opportunity’s distance of 28.06 miles, set during its Mars mission from 2004 to 2018.",
      "keywords": [
        "Mars exploration"
      ],
      "score": 84,
      "score_parts": {
        "relevance": 45,
        "attention": 39,
        "repeat_penalty": 0
      },
      "sources": [
        {
          "title": "Mars Exploration Archives - NASA Science",
          "publisher": "NASA Science",
          "url": "https://science.nasa.gov/blogs/mars/2026/10/",
          "language": "en",
          "published": "2026-10-12"
        },
        {
          "title": "Mars Exploration Archives",
          "publisher": "NASA Science",
          "url": "https://science.nasa.gov/blogs/mars/",
          "language": "en",
          "published": "2026-08-06"
        }
      ]
    },
    {
      "id": "fusion-shortcut-plasma",
      "continues": null,
      "new_development": null,
      "title": "Study points to a shortcut to fusion energy",
      "summary": "ScienceDaily reported that Princeton Plasma Physics Laboratory researchers may have found a more efficient route to fusion energy by heating plasma first and then increasing its density. The report says the approach reverses the traditional sequence used in many fusion concepts.",
      "detail": "The article says the work suggests a dramatically more efficient path to fusion energy. It identifies Princeton Plasma Physics Laboratory as the source of the finding and describes the method as reversing the usual order of operations.",
      "keywords": [
        "fusion energy"
      ],
      "score": 81,
      "score_parts": {
        "relevance": 48,
        "attention": 33,
        "repeat_penalty": 0
      },
      "sources": [
        {
          "title": "Scientists may have found a shortcut to fusion energy",
          "publisher": "ScienceDaily",
          "url": "https://www.sciencedaily.com/releases/2026/10/261008005242.htm",
          "language": "en",
          "published": "2026-10-17"
        }
      ]
    },
    {
      "id": "deep-sea-mining-trial-ecosystem",
      "continues": null,
      "new_development": null,
      "title": "Study warns deep-sea mining can disrupt seafloor microbes",
      "summary": "A report covered by Yahoo News said scientists from the Chinese Academy of Sciences found that deep-sea mining can rapidly disrupt microbes tied to nutrient cycling on the South China Sea floor. The article said the findings show the impact of disturbance on deep-sea ecosystems can appear quickly.",
      "detail": "The story said the paper offers a preview of how mining can affect seafloor ecosystems. It also noted that commercial deep-sea mining has not started yet, while the International Seabed Authority has issued exploration contracts.",
      "keywords": [
        "deep-sea mining"
      ],
      "score": 78,
      "score_parts": {
        "relevance": 47,
        "attention": 31,
        "repeat_penalty": 0
      },
      "sources": [
        {
          "title": "A Deep-Sea Mining Trial Rapidly Threw The Seafloor Ecosystem Off ...",
          "publisher": "Yahoo News",
          "url": "https://www.yahoo.com/news/science/articles/deep-sea-mining-trial-rapidly-080000631.html",
          "language": "en",
          "published": "2026-10-18"
        }
      ]
    },
    {
      "id": "american-metal-seabed-licence",
      "continues": null,
      "new_development": null,
      "title": "American Metal advances US seabed mining licence bid",
      "summary": "Mining.com.au reported that NOAA certified two exploration licence applications from American Metal subsidiaries for Pacific seabed minerals. The company said the applications cover part of the Clarion-Clipperton Zone in international waters.",
      "detail": "The article said NOAA will now complete an environmental study as the next step in the process. It also quoted American Metal CEO David Ruddell as saying he wants a commercial mining permit within three years.",
      "keywords": [
        "deep-sea mining"
      ],
      "score": 72,
      "score_parts": {
        "relevance": 46,
        "attention": 26,
        "repeat_penalty": 0
      },
      "sources": [
        {
          "title": "American Metal says US seabed mining exploration licence application advances",
          "publisher": "Mining.com.au",
          "url": "https://mining.com.au/american-metal-says-us-seabed-mining-exploration-licence-application-advances/",
          "language": "en",
          "published": "2026-10-16"
        }
      ]
    },
    {
      "id": "fusion-ferm-ilab-event",
      "continues": null,
      "new_development": null,
      "title": "Fusion leaders to discuss the field at Fermilab",
      "summary": "Fermilab said laboratory and industry leaders will gather on Oct. 13 for a public discussion on the future of fusion energy. The event included speakers from Lawrence Livermore, Fermilab, Argonne and Oak Ridge national laboratories.",
      "detail": "The notice said Kim Budil of Lawrence Livermore National Laboratory would present on the promise, progress and path ahead for fusion. It said the session would be held at Fermilab in Batavia, Illinois.",
      "keywords": [
        "fusion energy"
      ],
      "score": 64,
      "score_parts": {
        "relevance": 32,
        "attention": 32,
        "repeat_penalty": 0
      },
      "sources": [
        {
          "title": "National laboratory and industry leaders to discuss the future of fusion at Fermilab",
          "publisher": "Fermilab News",
          "url": "https://news.fnal.gov/2026/10/national-laboratory-and-industry-leaders-to-discuss-the-future-of-fusion-at-fermilab/",
          "language": "en",
          "published": "2026-10-01"
        }
      ]
    },
    {
      "id": "mmx-launch-announcement",
      "continues": null,
      "new_development": null,
      "title": "ESA says Japan’s MMX mission is set for launch",
      "summary": "ESA said the Martian Moons eXploration mission is set to launch on Oct. 19 or 20 from the Tanegashima Space Center. The mission aims to collect a sample from Phobos and return it to Earth.",
      "detail": "ESA said MMX is expected to enter orbit around Mars in August 2027 and orbit Phobos from September 2027. The launch timing was given in local and European time zones.",
      "keywords": [
        "Mars exploration"
      ],
      "score": 62,
      "score_parts": {
        "relevance": 31,
        "attention": 31,
        "repeat_penalty": 0
      },
      "sources": [
        {
          "title": "Mars moon lander set to launch on 19 October",
          "publisher": "ESA",
          "url": "https://www.esa.int/Science_Exploration/Space_Science/Mars_moon_lander_set_to_launch_on_19_October",
          "language": "en",
          "published": "2026-10-13"
        }
      ]
    }
  ]
}
