{
  "template_version": 1,
  "generated_at": "2026-10-18",
  "opening": "Here is the week’s digest.",
  "closing": "That is the briefing for now.",
  "topics": [
    {
      "id": "fusion-energy-shortcut",
      "continues": null,
      "new_development": null,
      "title": "Physicists report a possible fusion shortcut",
      "summary": "Researchers at Princeton Plasma Physics Laboratory reported a model suggesting that heating plasma before compression could reduce the energy needed for fusion ignition. The work also says tungsten contamination can sharply raise the pressure needed for ignition.",
      "detail": "The model adds four plasma effects and points to a lower-energy route the authors call a Cordey saddle. The researchers said the approach updates the Lawson criterion with synchrotron radiation, impurities and heat loss. They also said coating reactor interiors with liquid lithium could help limit tungsten contamination.",
      "keywords": [
        "fusion energy"
      ],
      "score": 92,
      "score_parts": {
        "relevance": 52,
        "attention": 40,
        "repeat_penalty": 0
      },
      "sources": [
        {
          "title": "Scientists may have found a shortcut to fusion energy",
          "publisher": "ScienceDaily",
          "url": "https://www.sciencedaily.com/releases/2026/10/261008005242.htm",
          "language": "en",
          "published": "2026-10-17"
        },
        {
          "title": "Fusion -- ANS / Nuclear Newswire",
          "publisher": "ANS",
          "url": "https://www.ans.org/news/topic-fusion/",
          "language": "en",
          "published": "2026-10-16"
        }
      ]
    },
    {
      "id": "deep-sea-mining-permits-and-ecosystem-risks",
      "continues": null,
      "new_development": null,
      "title": "US permit push meets fresh deep-sea mining warnings",
      "summary": "The Trump administration signaled it is nearing approval for deep-sea mining permits, according to reports on Sunday. Separate coverage said scientists found a trial in the South China Sea rapidly disrupted seafloor microbes tied to nutrient cycling.",
      "detail": "One report said Interior Secretary Doug Burgum announced plans to issue deep-sea mining permits within months as part of a push to expand critical mineral supply chains. Another report said a new paper from scientists at the Chinese Academy of Sciences describes rapid ecosystem disruption after a mining trial at about 1,300 meters deep. The same report said public comment on a US review process remains open until October 19.",
      "keywords": [
        "deep-sea mining"
      ],
      "score": 89,
      "score_parts": {
        "relevance": 54,
        "attention": 35,
        "repeat_penalty": 0
      },
      "sources": [
        {
          "title": "US aims to issue deep-sea mining permits within months, Interior Secretary Burgum says",
          "publisher": "Ground News",
          "url": "https://ground.news/article/us-aims-to-issue-deep-sea-mining-permits-within-months-interior-secretary-burgum-says",
          "language": "en",
          "published": "2026-10-18"
        },
        {
          "title": "A Deep-Sea Mining Trial Rapidly Threw The Seafloor Ecosystem Off Kilter",
          "publisher": "Yahoo News",
          "url": "https://www.yahoo.com/news/science/articles/deep-sea-mining-trial-rapidly-080000631.html",
          "language": "en",
          "published": "2026-10-18"
        }
      ]
    },
    {
      "id": "quantum-computing-funding-and-benchmarking",
      "continues": null,
      "new_development": null,
      "title": "Quantum firms press ahead with funding and benchmarks",
      "summary": "Recent quantum computing coverage highlighted major funding rounds and new benchmarking progress. Reports said DARPA advanced four more companies to the final verification phase of its Quantum Benchmarking Initiative, while other firms announced large financing rounds and hardware milestones.",
      "detail": "The reports said Atom Computing, Diraq, IBM and IonQ advanced to Stage C of the DARPA program. Coverage also said Oratomic closed a $475 million Series B, Universal Quantum raised more than $100 million, and IonQ reported a memory-enhanced photonic interconnect demonstration. Another item said Gartner projects global quantum computing revenue to reach $1.1 billion in 2027.",
      "keywords": [
        "quantum computing"
      ],
      "score": 82,
      "score_parts": {
        "relevance": 47,
        "attention": 35,
        "repeat_penalty": 0
      },
      "sources": [
        {
          "title": "Quantum Computing Weekly Round-Up",
          "publisher": "The Qubit Report",
          "url": "https://thequbitreport.com/quantum-computing-weekly-round-up/2026/10/11/quantum-computing-weekly-round-up-week-ending-october-10-2026/",
          "language": "en",
          "published": "2026-10-11"
        },
        {
          "title": "Quantum Computing News",
          "publisher": "Quantum Zeitgeist",
          "url": "https://quantumzeitgeist.com/category/quantum-computing-news/",
          "language": "en",
          "published": "2026-10-17"
        },
        {
          "title": "Quantum Computing Inc. News and Press Releases",
          "publisher": "PR Newswire",
          "url": "https://www.prnewswire.com/news/quantum-computing-inc./",
          "language": "en",
          "published": "2026-10-14"
        }
      ]
    }
  ]
}
