{
  "template_version": 1,
  "generated_at": "2026-10-18",
  "opening": "Here is the digest for the week’s requested topics.",
  "closing": "That is the full readout for this window.",
  "topics": [
    {
      "id": "antarctica-sea-ice-reversal",
      "continues": null,
      "new_development": null,
      "title": "Antarctic sea ice hits third-lowest winter maximum",
      "summary": "A new report says Antarctic sea ice reached its third-lowest winter maximum in 2026, extending a steep decline after years of unusually high ice coverage. Scientists are tracking whether the shift marks a lasting change in Antarctic sea ice conditions.",
      "detail": "The report says the 2026 winter peak covered about 17.59 million square kilometers. It says this was the third-lowest winter maximum in the satellite record. The article says researchers are continuing to monitor whether the decline is a long-term transformation or part of natural variability.",
      "keywords": [
        "Antarctic research"
      ],
      "score": 80,
      "score_parts": {
        "relevance": 40,
        "attention": 40,
        "repeat_penalty": 0
      },
      "sources": [
        {
          "title": "Antarctica's sea ice has undergone a stunning reversal",
          "publisher": "ScienceDaily",
          "url": "https://www.sciencedaily.com/releases/2026/10/261015073210.htm",
          "language": "en",
          "published": "2026-10-17"
        }
      ]
    },
    {
      "id": "riyadh-urban-cycling-world-championships-cancelled",
      "continues": null,
      "new_development": null,
      "title": "Urban cycling worlds in Riyadh are cancelled",
      "summary": "The UCI has cancelled the Urban Cycling World Championships that were set for Riyadh from November 3 to 7. The decision followed a week of attacks on Riyadh airport, according to the report.",
      "detail": "The event had been scheduled to run in Saudi Arabia in early November. The article says the cancellation was announced after attacks on the airport in Riyadh. No replacement venue or revised dates were reported.",
      "keywords": [
        "urban cycling"
      ],
      "score": 78,
      "score_parts": {
        "relevance": 39,
        "attention": 39,
        "repeat_penalty": 0
      },
      "sources": [
        {
          "title": "The Urban Cycling World Championships in Riyadh have been cancelled",
          "publisher": "Escape Collective",
          "url": "https://escapecollective.com/the-uci-cancels-the-urban-cycling-world-championships-in-riyadh/",
          "language": "en",
          "published": "2026-10-16"
        }
      ]
    },
    {
      "id": "kilauea-alert-level-watch",
      "continues": null,
      "new_development": null,
      "title": "Kilauea stays at watch level after eruption ends",
      "summary": "The U.S. Geological Survey said Kilauea was at WATCH level on October 14, and later said the volcano remained at advisory status on October 17. A separate update said episode 55 of the ongoing Halemaʻumaʻu eruption ended abruptly on October 17.",
      "detail": "The USGS notice said Kilauea was at WATCH in the October 14 update. The later volcano updates page said the alert level was ADVISORY and that episode 55 ended at 9:03 a.m. HST on October 17. The same page said monitoring data remained consistent with background activity levels in the Cascade Range, but that was a separate update.",
      "keywords": [
        "volcanoes"
      ],
      "score": 74,
      "score_parts": {
        "relevance": 34,
        "attention": 40,
        "repeat_penalty": 0
      },
      "sources": [
        {
          "title": "USGS Volcano Notice - DOI-USGS-HVO-2026-10-14T23:37:43+00:00",
          "publisher": "USGS Volcanoes",
          "url": "https://volcanoes.usgs.gov/hans-public/notice/DOI-USGS-HVO-2026-10-14T23:37:43+00:00",
          "language": "en",
          "published": "2026-10-14"
        },
        {
          "title": "Volcano Updates | U.S. Geological Survey - USGS.gov",
          "publisher": "USGS",
          "url": "https://www.usgs.gov/programs/VHP/volcano-updates",
          "language": "en",
          "published": "2026-10-17"
        }
      ]
    },
    {
      "id": "ukrainian-antarctic-expedition-2026",
      "continues": null,
      "new_development": null,
      "title": "Ukrainian scientists begin new Antarctic season",
      "summary": "The Ukrainian research vessel Noosphere has sailed from Cape Town to Antarctica, starting the sixth Antarctic season of the Ukrainian expedition. Scientists plan work in the Weddell Sea with Swedish colleagues, along with logistics stops at Polish and Chilean stations.",
      "detail": "The report says the Noosphere will first stop at the Polish Antarctic station Arctowski. It then will head to Punta Arenas to collect Ukrainian seasonal researchers and cargo for the Akademik Vernadsky station. The season’s planned work includes studies of extremophile organisms near hydrothermal vents, cold-water corals, atmospheric rivers, ocean currents, and a sunken ship.",
      "keywords": [
        "Antarctic research"
      ],
      "score": 72,
      "score_parts": {
        "relevance": 42,
        "attention": 30,
        "repeat_penalty": 0
      },
      "sources": [
        {
          "title": "Ukrainian scientists will search for a sunken ship and coral reefs in Antarctica",
          "publisher": "Intent Press",
          "url": "https://intent.press/en/amp/0/ukrainian-scientists-will-search-for-a-sunken-ship-and-coral-reefs-in-antarctica/",
          "language": "en",
          "published": "2026-10-13"
        }
      ]
    }
  ]
}
