{
  "template_version": 1,
  "generated_at": "2026-10-18",
  "opening": "A brief wire digest follows.",
  "closing": "That is the day’s compact read.",
  "topics": [
    {
      "id": "portugal-high-speed-rail-construction",
      "continues": null,
      "new_development": null,
      "title": "Portugal starts Lisbon-Porto high-speed rail work",
      "summary": "Portugal began construction on the first section of its high-speed rail line linking Lisbon and Porto, with work starting between Porto-Campanhã and Oiã.[1] The government said the line is intended to cut the trip between the two cities to 1 hour and 15 minutes when completed.[1]",
      "detail": "The section under construction is 71 kilometres long and includes a new road-rail bridge over the Douro River, a new station at Vila Nova de Gaia-Santo Ovídio, and an expansion of Porto-Campanhã Intermodal Station.[1] The government said the concession contract for the section will cost around €2 billion.[1] It said the project includes €875 million in European Investment Bank financing and €480 million from the Connecting Europe Facility.[1]",
      "keywords": [
        "high-speed rail in Europe"
      ],
      "score": 87,
      "score_parts": {
        "relevance": 52,
        "attention": 35,
        "repeat_penalty": 0
      },
      "sources": [
        {
          "title": "Portugal begins high-speed rail construction between Lisbon and Porto",
          "publisher": "Euronews",
          "url": "https://www.euronews.com/2026/10/12/portugal-begins-construction-of-high-speed-rail-line-linking-lisbon-and-porto",
          "language": "en",
          "published": "2026-10-12"
        }
      ]
    },
    {
      "id": "coral-reefs-health-birds",
      "continues": null,
      "new_development": null,
      "title": "Study links healthier coral reefs to seabird colonies",
      "summary": "A report said coral reefs near seabird colonies are generally healthier because birds deposit nutrients in guano.[2] The piece said the finding points to a direct link between seabird restoration and reef recovery.[2]",
      "detail": "The article focused on reefs near Palmyra Atoll and described birds as a \"secret weapon\" for reef health.[2] It said the nutrient input from seabirds helps support the surrounding reef ecosystem.[2]",
      "keywords": [
        "coral reefs"
      ],
      "score": 61,
      "score_parts": {
        "relevance": 38,
        "attention": 23,
        "repeat_penalty": 0
      },
      "sources": [
        {
          "title": "Some of the most pristine coral reefs have a secret weapon: birds",
          "publisher": "NPR",
          "url": "https://www.npr.org/2026/10/13/nx-s1-5901320/coral-reefs-palmyra-atoll-birds-restoration",
          "language": "en",
          "published": "2026-10-13"
        }
      ]
    },
    {
      "id": "formula-1-race-schedule",
      "continues": null,
      "new_development": null,
      "title": "Formula 1 enters a scheduled break after Singapore",
      "summary": "Coverage from the week said Formula 1 is on a scheduled weekend off after the Singapore Grand Prix.[3][4] The next race is set for October 23-25 at Circuit of The Americas in Austin, Texas.[3][4]",
      "detail": "One report described the sport’s calendar as a regionalized schedule with a European midseason and races in Asia, the Americas and Australia around it.[4] Another item from the official F1 site listed the 2026 calendar and showed the Singapore round in the October 9-11 slot.[3]",
      "keywords": [
        "Formula 1"
      ],
      "score": 58,
      "score_parts": {
        "relevance": 28,
        "attention": 30,
        "repeat_penalty": 0
      },
      "sources": [
        {
          "title": "F1 Schedule 2026 - Official Calendar of Grand Prix Races",
          "publisher": "Formula 1",
          "url": "https://www.formula1.com/en/racing/2026",
          "language": "en",
          "published": "2026-10-13"
        },
        {
          "title": "Is there an F1 race this weekend? Here’s when Formula 1 returns",
          "publisher": "Grande Prêmio",
          "url": "https://grandepremio.com/en/f1/is-there-an-f1-race-this-weekend-heres-when-formula-1-returns/",
          "language": "en",
          "published": "2026-10-16"
        },
        {
          "title": "The Complicated Puzzle of the Formula 1 Schedule",
          "publisher": "The New York Times",
          "url": "https://www.nytimes.com/2026/10/13/sports/f1-schedule.html",
          "language": "en",
          "published": "2026-10-13"
        }
      ]
    },
    {
      "id": "open-source-software-notable-release",
      "continues": null,
      "new_development": null,
      "title": "No qualifying open-source software story found",
      "summary": "No article published in the window clearly matched the open-source software keyword with a discrete news story.[0] The available results were unrelated schedule pages or general tech coverage.",
      "detail": null,
      "keywords": [
        "open-source software"
      ],
      "score": 0,
      "score_parts": {
        "relevance": 0,
        "attention": 0,
        "repeat_penalty": 0
      },
      "sources": [
        {
          "title": "Search results did not yield a qualifying article",
          "publisher": "N/A",
          "url": "https://www.example.com",
          "language": "en",
          "published": "2026-10-18"
        }
      ]
    },
    {
      "id": "battery-recycling-news",
      "continues": null,
      "new_development": null,
      "title": "No qualifying battery recycling story found",
      "summary": "No article published in the window clearly matched the battery recycling keyword with a distinct news story.[0] The available results did not provide a supported topic for the digest.",
      "detail": null,
      "keywords": [
        "battery recycling"
      ],
      "score": 0,
      "score_parts": {
        "relevance": 0,
        "attention": 0,
        "repeat_penalty": 0
      },
      "sources": [
        {
          "title": "Search results did not yield a qualifying article",
          "publisher": "N/A",
          "url": "https://www.example.com",
          "language": "en",
          "published": "2026-10-18"
        }
      ]
    }
  ]
}
