{
  "template_version": 1,
  "generated_at": "2026-10-18",
  "opening": "Here is the week’s short digest.",
  "closing": "That is the bulletin for now.",
  "topics": [
    {
      "id": "deep-sea-mining-permits",
      "continues": null,
      "new_development": null,
      "title": "US moves toward deep-sea mining permits",
      "summary": "The Trump administration signaled it is moving toward approving deep-sea mining permits within months, according to reports on October 18. The effort is part of a broader push to expand access to critical minerals for electronics and defense industries.",
      "detail": "The reporting says Interior Secretary Doug Burgum announced the plan on Monday. It also says the administration is seeking both domestic and international mining permits. Earthjustice and conservation groups are challenging the permits in court, while opponents warn about possible harm to marine animals and biodiversity.",
      "keywords": [
        "deep-sea mining"
      ],
      "score": 72,
      "score_parts": {
        "relevance": 50,
        "attention": 22,
        "repeat_penalty": 0
      },
      "sources": [
        {
          "title": "US aims to issue deep-sea mining permits within months, Interior Secretary Burgum says",
          "publisher": "Ground News",
          "url": "https://ground.news/article/us-aims-to-issue-deep-sea-mining-permits-within-months-interior-secretary-burgum-says",
          "language": "en",
          "published": "2026-10-18"
        },
        {
          "title": "Deep-Sea Mining could begin in Pacific without agreed global rules",
          "publisher": "Pacific Islands News Association",
          "url": "https://pina.com.fj/tag/deep-sea-mining/",
          "language": "en",
          "published": "2026-10-18"
        }
      ]
    },
    {
      "id": "quantum-computing-roundup",
      "continues": null,
      "new_development": null,
      "title": "Quantum computing funding and hardware accelerate",
      "summary": "Several quantum computing developments landed in the window, including a large funding round, government benchmarking progress, and a hardware interconnect demonstration. The strongest single source in the set was a weekly round-up dated October 11.",
      "detail": "The round-up said Oratomic closed a $475 million Series B valuing the company at $5.4 billion. It also said DARPA advanced four more companies in the Quantum Benchmarking Initiative and that IonQ reported a memory-enhanced photonic interconnect with more than 1,000 events per second and 87.9 percent fidelity. A separate source on October 11 reported Hamad Bin Khalifa University and Quantum Computing Inc. partnering on quantum skills.",
      "keywords": [
        "quantum computing"
      ],
      "score": 69,
      "score_parts": {
        "relevance": 48,
        "attention": 21,
        "repeat_penalty": 0
      },
      "sources": [
        {
          "title": "Quantum Computing Weekly Round-Up",
          "publisher": "The Qubit Report",
          "url": "https://thequbitreport.com/quantum-computing-weekly-round-up/2026/10/11/quantum-computing-weekly-round-up-week-ending-october-10-2026/",
          "language": "en",
          "published": "2026-10-11"
        },
        {
          "title": "Quantum Computing News",
          "publisher": "Quantum Zeitgeist",
          "url": "https://quantumzeitgeist.com/category/quantum-computing-news/",
          "language": "en",
          "published": "2026-10-17"
        }
      ]
    }
  ]
}
