{
  "template_version": 1,
  "generated_at": "2026-10-18",
  "opening": "Here is the digest for the week.",
  "closing": "That is the slate for now.",
  "topics": [
    {
      "id": "deep-sea-mining-deal",
      "continues": null,
      "new_development": null,
      "title": "Deep-sea miner plans $1 billion merger",
      "summary": "American Ocean Minerals, led by former Rio Tinto chief Tom Albanese, will merge with Odyssey Marine Exploration in a $1 billion all-stock deal. The company said the combined group will target underwater mineral deposits and list on Nasdaq under the ticker AOMC.",
      "detail": "The deal was announced on October 11. The company said the merger will bring together a portfolio of deep-sea mineral assets, including polymetallic nodules. The article said the close is expected by August. It also said the industry still faces diplomatic and regulatory challenges.",
      "keywords": [
        "deep-sea mining"
      ],
      "score": 78,
      "score_parts": {
        "relevance": 55,
        "attention": 23,
        "repeat_penalty": 0
      },
      "sources": [
        {
          "title": "Ex-Rio Tinto CEO's deep-sea mining firm to merge with Odyssey in $1 billion deal",
          "publisher": "The Economic Times",
          "url": "https://economictimes.indiatimes.com/markets/us-stocks/news/ex-rio-tinto-ceos-deep-sea-mining-firm-to-merge-with-odyssey-in-1-billion-deal/printarticle/130120738.cms",
          "language": "en",
          "published": "2026-10-11"
        }
      ]
    },
    {
      "id": "formula-1-singapore-result",
      "continues": null,
      "new_development": null,
      "title": "Verstappen wins Singapore Grand Prix",
      "summary": "Max Verstappen won the Singapore Grand Prix on October 11. One report said Lewis Hamilton finished second and Charles Leclerc third, while another said the weekend was the scheduled Singapore round before the championship paused until Austin.",
      "detail": "The race took place at Marina Bay as part of the 2026 Formula 1 schedule. Coverage also noted that there were no championship sessions on October 17 or 18, with the next race set for October 23 to 25 in Austin. Multiple results pages and reports on the event were published during the window.",
      "keywords": [
        "Formula 1"
      ],
      "score": 74,
      "score_parts": {
        "relevance": 52,
        "attention": 22,
        "repeat_penalty": 0
      },
      "sources": [
        {
          "title": "Formula 1 Results & Race Reports - BBC Sport",
          "publisher": "BBC Sport",
          "url": "https://www.bbc.com/sport/formula1/results",
          "language": "en",
          "published": "2026-10-12"
        },
        {
          "title": "Is there an F1 race this weekend? Here’s when Formula 1 returns",
          "publisher": "grandepremio.com",
          "url": "https://grandepremio.com/en/f1/is-there-an-f1-race-this-weekend-heres-when-formula-1-returns/",
          "language": "en",
          "published": "2026-10-16"
        }
      ]
    }
  ]
}
