{
  "template_version": 1,
  "generated_at": "2026-10-18",
  "opening": "Folks, let's cut through the noise and get to what actually matters this week.",
  "closing": "And remember, my wife is a doctor—she'd tell you the same thing.",
  "topics": [
    {
      "id": "stellarator-plasma-record",
      "continues": null,
      "new_development": null,
      "title": "Stellarator holds plasma 40 minutes, a record",
      "summary": "A research stellarator sustained a stable plasma for 40 minutes, four times its previous best, thanks to a new tungsten wall coating. The lab plans a one-hour campaign at higher density next spring. Net energy gain remains years away.",
      "detail": "Engineers credited the tungsten coating for shedding less material into the plasma, extending the shot duration. Two outside physicists called the result real but incremental. The lab announced a spring 2027 campaign aiming for a one-hour pulse at higher density.",
      "keywords": [
        "fusion energy"
      ],
      "score": 82,
      "score_parts": {
        "relevance": 55,
        "attention": 27,
        "repeat_penalty": 0
      },
      "sources": [
        {
          "title": "Test stellarator holds plasma for a record 40 minutes",
          "publisher": "Example Science Daily",
          "url": "https://science.example.com/2026/10/stellarator-record",
          "language": "en",
          "published": "2026-10-16"
        },
        {
          "title": "Le stellarator d'essai bat son record de durée",
          "publisher": "Exemple Sciences",
          "url": "https://sciences.example.org/stellarator-record",
          "language": "fr",
          "published": "2026-10-17"
        }
      ]
    },
    {
      "id": "seabed-mining-moratorium-vote",
      "continues": "seabed-mining-talks",
      "new_development": "The seabed authority has now scheduled a formal vote on a 10-year moratorium for its November session, with the agenda published for 12 November.",
      "title": "Seabed authority schedules moratorium vote",
      "summary": "An international seabed body agreed to vote on a 10-year commercial deep-sea mining moratorium at its November session. Twelve member states back the pause, while two companies with exploration contracts say it would breach existing agreements. The vote is set for 12 November.",
      "detail": "The council agreed on Monday to put the moratorium to a vote, and the published agenda confirms the vote for 12 November. A two-thirds majority is required for passage. Two companies holding exploration contracts argue a moratorium would violate their existing agreements.",
      "keywords": [
        "deep-sea mining"
      ],
      "score": 78,
      "score_parts": {
        "relevance": 55,
        "attention": 28,
        "repeat_penalty": 5
      },
      "sources": [
        {
          "title": "Seabed authority schedules a vote on a mining moratorium",
          "publisher": "Example Ocean News",
          "url": "https://ocean.example.com/seabed-vote",
          "language": "en",
          "published": "2026-10-14"
        },
        {
          "title": "Council agenda lists the moratorium for 12 November",
          "publisher": "Example Wire",
          "url": "https://wire.example.net/council-agenda",
          "language": "en",
          "published": "2026-10-15"
        }
      ]
    },
    {
      "id": "chess-youth-time-control-trial",
      "continues": null,
      "new_development": null,
      "title": "Chess federation trials shorter youth games",
      "summary": "A national chess federation will trial 45-minute games with a 10-second increment at three youth events this winter, citing shorter attention spans and travel costs. Coaches are split on the change.",
      "detail": "The federation announced the trial for three youth events this winter, replacing longer time controls. Officials cited shorter attention spans and travel costs as reasons. Coaches quoted in the report were divided, with some welcoming the change and others concerned about game quality.",
      "keywords": [
        "chess"
      ],
      "score": 45,
      "score_parts": {
        "relevance": 30,
        "attention": 15,
        "repeat_penalty": 0
      },
      "sources": [
        {
          "title": "Chess federation tests a shorter time control for youth events",
          "publisher": "Example Board Games Review",
          "url": "https://boardgames.example.org/youth-time-control",
          "language": "en",
          "published": "2026-10-13"
        }
      ]
    }
  ]
}
