{
  "template_version": 1,
  "generated_at": "2026-10-18",
  "opening": "This digest covers your selected topics, but no qualifying recent reports matched the criteria in this period.",
  "closing": "No topics are included today; the next digest will resume when suitable coverage appears.",
  "topics": []
}
